,participants,file_name,date,idx,company_paticipants_yes,other_paticipants_yes,company_name,paraghrph,paraghrph_clean,paraghrph_noun,token,word_count,char_count,sentence_count,avg_word_length,avg_sentence_length,token_len,topic_1,topic_2,topic_3,topic_4,topic_5,topic_6,topic_7,topic_8,topic_9,topic_10,topic_11,topic_12,topic_13,topic_14,topic_15,topic_16,topic_17,topic_18,topic_19,topic_20,topic_21,topic_22,topic_23,topic_24,topic_25,topic_26,topic_27,topic_28,main_tp
873,Hedwig Ulmer,20210622_Helvetia_Holding_AG-_Shareholder_Mtg_Call_2021-6-22_DN000000002960143282.pdf,2021-06-22,274.0,1,0,Helvetia Holding,"On the offering side, we initiated the shift away from classic guarantees to investment-linked products, years ago both in private pension and in occupational pension. In the occupational pension benefit scheme around half of the insured persons are already in so-called semiautonomous solutions. This Development will continue we have also adjusted the occupational pension scheme as far as possible to the economic reality with low interest rates and increasing life expectancy and for example, lowered conversion rates. Helvetia is first mover here the other insurance companies are now following.",On the offering side we initiated the shift away from classic guarantees to -linked products years ago both in private pension and in occupational pension In the occupational pension benefit scheme around half of the insured persons are already in so-called semiautonomous solutions This Development will continue we have also adjusted the occupational pension scheme as far as possible to the economic reality with low interest rates and increasing life expectancy and for example lowered conversion rates Helvetia is first mover here the other  companies are now following,offering side shift guarantee product year pension pension pension benefit scheme half person solution pension scheme reality interest rate life expectancy example conversion rate mover company,"['offer', 'shift', 'guarantee', 'pension', 'pension', 'pension', 'benefit', 'scheme', 'person', 'solution', 'pension', 'scheme', 'reality', 'expectancy', 'conversion', 'mover']",23,146,5,6.3478260869565215,4.6,16,0.006351851,0.00649365,0.007942502,0.0065187337,0.0072335503,0.005471735,0.0023385799,0.005900147,0.0047689294,0.0073287785,0.0053522545,0.0038293654,0.110104784,0.006675643,0.0029298423,0.0018828136,0.0014018868,0.0035394186,0.0039443816,0.006702662,0.006987623,0.0099868635,0.11634412,0.0020048434,0.0036167551,0.64584196,0.003107257,0.005399125,topic_26
2352,Simon George Thomas,20141110_Just_Group_PLC-_Sales_Results_Call_2014-11-10_FS000000002180720607.pdf,2014-11-10,8.0,1,0,Just Group," 15219564  Thank you, operator. Thank you, operator. I'm Simon Thomas, CFO of Just Retirement, and I'd like to welcome you all to this conference call to discuss our IMS for the three months ended 30 of September, 2014. We really do appreciate your interest. And I'm joined on the line by Shayne Deighton, our Chief Actuary, and David Cooper, our Director of Marketing and Distribution. I'll talk briefly about our first quarter's trading statement and then we'll have some time for your questions. Please do remember that we have a June year-end, so the first quarter of our 2014/2015 financial year, which is under discussion now, represents the third quarter of the calendar year. So, first, we're today reporting a 42% fall in total sales, driven by a 48% fall in total annuity sales and a 23% fall in lifetime mortgages. Total annuity sales would have only been 26% lower if they had included the £75 million DB scheme we told you about a couple of weeks ago. This was signed in September and closed in October, making it a Q2 event. The 48% fall in total annuity volumes reflects the net effect of very different conditions experienced by our individual business compared to our DB de-risking business. DB continued to grow strongly. Sales were up roughly sevenfold compared to the equivalent prior-year quarter to £24.8 million, obviously excluding the £75 million sale announced in October. If that scheme had been written a week earlier, then we would have written more DB business in Q1 than in the whole of the previous year. We're are also pleased to be able to announce that we signed contracts on another large DB scheme for £76 million, which is due to complete later this week. Base effects means DB growth rates will start to look more normal as the year progresses, but the business remains inherently lumpy and will continue to be volatile in shape. Trustees meet infrequently and the business is made up of a small number of relatively large transactions, so this lumpiness won't go away. But out of the total £1.8 trillion of DB scheme liabilities in the market, there are over £600 billion of pensions in payment for us to target. Even if only a small percentage can benefit from our medical underwriting each year, this provides a strong growth potential. Many years of ALM work has reduced the volatility of the capital position of most DB schemes. This has improved the consistency of trustee demand, but not to the point that it will grow in a nice straight line. The IUA picture is more challenging, as we continue to come to terms with the budget's aftermath. IUA sales were 59% lower than in the equivalent quarter of our previous financial year. They fell by 55%, if we compare them to the first calendar quarter of this year, which was the last to be unaffected by the budget. So it's difficult to portray this as anything other than a tough quarter for IUA volumes, albeit not as bad as the 90% drops some had predicted. We believe that for customers with less than £100,000 to work with, guaranteed lifetime income will continue to be a key part of their post-retirement financial planning, and our medical underwriting skills mean we can offer many of them a better income. We managed mortgage volumes down by 23% in the quarter, against a tide of good market growth. Including the large DB sale which ended up being booked in Q2, the fall in lifetime mortgage sales was broadly in line with the drop in annuity sales. The mortgages continue to offer a great match to our liabilities, especially DB, which tends to bring longer duration cash flows. As of today, trading conditions for IUAs have continued in the current quarter in line with our Q1 run rate. But, as we've flagged in several places, there is a risk of further volatility ahead of the new rules in April. So, even though DB volumes have exceeded our expectations so far, we are limiting ourselves to saying that we remain confident in achieving our overall full-year sales expectations, rather than talking prospects up. Obviously, we'll update you as the year progresses, but I think you can understand the huge uncertainties we face in the current sales environment. Now, before we move on to Q&A, I want to pre-empt the inevitable questions about the new products we'll be launching once the rules change in April. In addition to the core retirement income proposition, we'll also offer a product allowing customers to leave some of their assets invested, whilst converting most of their retirement funds into a guaranteed income for life. It's key to remember that our average case size is around £60,000, which often means our mass market customers really do need the additional income which a guaranteed income solution offers, rather than relying on the state pension. At this level, few financial advisors consider it prudent or economic to do the work required to put them into drawdown, given the relatively small sums involved by drawdown standards. Please don't forget this when you write about it. For our individual customers, inheritance tax and often even income tax are simply not an issue once they retire, but enhancing the state pension with the best value guaranteed income solution they can get in order to pay their bills is. That's why we remain confident that our individual retirement income offering will remain relevant into the future. Our medical underwriting skills place us uniquely to provide value for money to secure income benefits. We'll update you further on the new products early next year. Now, with that, I'd like to turn it over to questions. Q&A",   Thank you  Thank you  I'm   CFO of Just Retirement and I'd like to welcome you all to this conference call to discuss our IMS for the three months ended  of September  We really do appreciate your interest And I'm joined on the  by   our  Actuary and   our  of eting and Distribution I'll talk briefly about our first quer's trading statement and then we'll have some time for your questions Please do remember that we have a e year-end so the first quer of our / financial year which is un discussion now represents the third quer of the calendar year So first we're today reporting a % fall in total sales driven by a % fall in total annuity sales and a % fall in lifetime mortgages Total annuity sales would have only been % lower if they had included the £ million DB scheme we told you about a couple of weeks ago This was signed in September and closed in October making it a Q event The % fall in total annuity volumes reflects the net effect of very different conditions experienced by our individual  compared to our DB de-ing  DB continued to grow strongly Sales were up roughly sevenfold compared to the equivalent prior-year quer to £ million obviously excluding the £ million sale announced in October If that scheme had been written a week earr then we would have written more DB  in Q than in the whole of the previous year We're are also pleased to be able to announce that we signed contracts on another large DB scheme for £ million which is due to complete later this week Base effects means DB growth rates will st to look more normal as the year progresses but the  remains inherently lumpy and will continue to be volatile in shape Trustees meet infrequently and the  is made up of a small number of relatively large transactions so this lumpiness won't go away But out of the total £ trillion of DB scheme liabilities in the market there are over £ billion of pensions in payment for us to target Even if only a small percentage can benefit from our medical unwriting each year this provides a strong growth potential Many years of ALM work has reduced the volatility of the capital position of most DB schemes This has improved the consistency of trustee demand but not to the point that it will grow in a nice straight  The IUA picture is more challenging as we continue to come to terms with the budget's aftermath IUA sales were % lower than in the equivalent quer of our previous financial year They fell by % if we compare them to the first calendar quer of this year which was the last to be unaffected by the budget So it's difficult to portray this as anything other than a tough quer for IUA volumes albeit not as bad as the % drops some had predicted We beve that for customers with less than £ to work with guaranteed lifetime income will continue to be a key p of their post- financial planning and our medical unwriting skills mean we can offer many of them a better income We d mortgage volumes down by % in the quer against a tide of good market growth Including the large DB sale which ended up being booked in Q the fall in lifetime mortgage sales was broadly in  with the drop in annuity sales The mortgages continue to offer a great match to our liabilities especially DB which tends to bring longer duration cash flows As of today trading conditions for IUAs have continued in the current quer in  with our Q run rate But as we've flagged in several places there is a  of further volatility ahead of the new rules in April So even though DB volumes have exceeded our expectations so far we are ing ourselves to saying that we remain confit in achieving our overall full-year sales expectations rather than talking prospects up Obviously we'll update you as the year progresses but I think you can unstand the huge uncertainties we face in the current sales environment Now before we move on to Q&A I want to pre-empt the inevitable questions about the new products we'll be launching once the rules change in April In addition to the core  income proposition we'll also offer a product allowing customers to leave some of their assets invested whilst converting most of their  funds into a guaranteed income for life It's key to remember that our average case size is around £ which often means our mass market customers really do need the additional income which a guaranteed income solution offers rather than relying on the state pension At this level few financial advisors consi it prut or economic to do the work required to put them into down given the relatively small sums involved by down standards Please don't forget this when you write about it For our individual customers inheritance tax and often even income tax are simply not an issue once they retire but enhancing the state pension with the best value guaranteed income solution they can get in or to pay their bills is That's why we remain confit that our individual  income offering will remain relet into the future Our medical unwriting skills place us uniquely to provide value for money to secure income benefits We'll update you further on the new products early next year Now with that I'd like to turn it over to questions Q&A,conference call month interest eting distribution quer trading statement time question e year end quer year quer calendar year today % fall sale % fall annuity sale % fall lifetime mortgage annuity sale % db scheme couple week q event % fall annuity volume effect condition sale sevenfold year quer sale scheme week earr q whole year contract scheme week effect db growth rate year shape trustee number transaction lumpiness scheme liability market pension payment percentage unwriting year growth potential year work volatility capital position scheme consistency trustee demand point picture term budget aftermath sale % quer year % calendar quer year budget quer volume % customer lifetime income p planning unwriting skill income mortgage volume % quer tide market growth sale q fall lifetime mortgage sale drop annuity sale mortgage match liability duration cash flow today trading condition iua quer q run rate place volatility rule volume expectation confit year sale expectation prospect year uncertainty sale environment question product rule addition income proposition product customer asset fund income life key case size £ mass market customer income income solution state pension level advisor work sum standard customer tax income tax issue state pension value income solution bill confit income offering future unwriting skill value money income benefit product year question,"['eting', 'distribution', 'trading', 'statement', 'calendar', 'fall', 'fall', 'annuity', 'fall', 'lifetime', 'mortgage', 'annuity', 'db', 'scheme', 'couple', 'fall', 'annuity', 'volume', 'condition', 'sevenfold', 'scheme', 'earr', 'contract', 'scheme', 'db', 'shape', 'trustee', 'transaction', 'lumpiness', 'scheme', 'liability', 'pension', 'payment', 'percentage', 'unwriting', 'potential', 'work', 'volatility', 'scheme', 'consistency', 'trustee', 'demand', 'picture', 'budget', 'aftermath', 'calendar', 'budget', 'volume', 'lifetime', 'planning', 'unwriting', 'skill', 'mortgage', 'volume', 'tide', 'fall', 'lifetime', 'mortgage', 'drop', 'annuity', 'mortgage', 'match', 'liability', 'duration', 'flow', 'trading', 'condition', 'iua', 'place', 'volatility', 'rule', 'volume', 'expectation', 'confit', 'expectation', 'prospect', 'uncertainty', 'rule', 'addition', 'proposition', 'fund', 'key', 'size', 'mass', 'solution', 'state', 'pension', 'advisor', 'work', 'sum', 'standard', 'tax', 'tax', 'state', 'pension', 'solution', 'confit', 'offer', 'future', 'unwriting', 'skill', 'money', 'benefit']",185,1113,46,6.0162162162162165,4.021739130434782,103,0.038975406,0.0011474015,0.03925647,0.04846816,0.0012781388,0.00096683326,0.00041321755,0.0010425319,0.00084265036,0.06753782,0.0009457215,0.09530928,0.0005285364,0.010642824,0.0005176912,0.0003326855,0.00024770768,0.0006254008,0.0006969562,0.08635372,0.0012346845,0.0017646381,0.0016310022,0.009817513,0.00063906587,0.58728087,0.0005490396,0.0009540034,topic_26
