,participants,file_name,date,idx,company_paticipants_yes,other_paticipants_yes,company_name,paraghrph,paraghrph_clean,paraghrph_noun,token,word_count,char_count,sentence_count,avg_word_length,avg_sentence_length,token_len,topic_1,topic_2,topic_3,topic_4,topic_5,topic_6,topic_7,topic_8,topic_9,topic_10,topic_11,topic_12,topic_13,topic_14,topic_15,topic_16,topic_17,topic_18,topic_19,topic_20,topic_21,topic_22,topic_23,topic_24,topic_25,topic_26,topic_27,main_tp
3064,Darren Christopher Godfrey,20180801_INTACT_FINANCIAL-_Earnings_Call_2018-8-1_DN000000002450289092.pdf,2018-08-01,586.0,1,0,INTACT FINANCIAL-," 19791482  No, absolutely. I think a little bit more context I can provide there. Within the quarter itself, so Q2-over-Q2, yes, we did talk about pools did impact the current accident year by a 1 point. But pools also favorably impacted the PYD for a 1 point. So if you're looking in aggregate in particular in the quarter, pools had zero impact in totality in Q2. Now, when we look year-to-date, pools are actually favorably impacting our combined ratio by roughly 0.6 points which is very much in line with our long-term expectations. We're going to see -- as we have seen in the past, we're going to see some noise from quarter-to-quarter. We're going to see noise between current accident year and prior accident years that will continue. Obviously, there's an element of the pools as you talk about the assumed element that we're not reserving that, that's coming from the industry. So we do tend to get a little bit of noise. I would expect that. But pools itself historically and also year-to-date, I think, are a source of gain for us from a combined ratio standpoint.",   No absolutely I think a little bit more context I can provide there hin the quer itself so Q-over-Q yes we did talk about pools did impact the current accit year by a  point But pools also favorably impacted the PYD for a  point So if you're looking in aggregate in picular in the quer pools had zero impact in totality in Q Now when we look year-to-date pools are actually favorably impacting our combined ratio by roughly  points which is very much in  with our long-term expectations We're going to see -- as we have seen in the past we're going to see some noise from quer-to-quer We're going to see noise between current accit year and prior accit years that will continue Obviously there's an element of the pools as you talk about the assumed element that we're not reserving that that's coming from the industry So we do tend to get a little bit of noise I would expect that But pools itself histoally and also year-to-date I think are a source of gain for us from a combined ratio standpoint,bit context quer q q pool accit year point pool point aggregate picular quer pool impact totality year date pool ratio point term expectation past noise quer quer noise accit year accit year element pool element industry bit noise pool year date source gain ratio standpoint,"['context', 'pool', 'accit', 'pool', 'aggregate', 'pool', 'totality', 'pool', 'noise', 'noise', 'accit', 'accit', 'pool', 'noise', 'pool', 'source', 'standpoint']",41,215,14,5.243902439024391,2.9285714285714284,17,0.0033862754,0.00479071,0.009833747,0.006032366,0.0022191473,0.0033573182,0.0050233863,0.0050609,0.005245286,0.0071256026,0.0054744403,0.0067421943,0.0060104583,0.0036251806,0.007332811,0.003634879,0.86769766,0.008370431,0.0059365486,0.002633492,0.0056170817,0.0041579767,0.0006218673,0.0047001243,0.003845424,0.0048694303,0.0066552185,topic_17
2090,Charles Brindamour,20160727_INTACT_FINANCIAL-_Earnings_Call_2016-7-27_FS000000002293688046.pdf,2016-07-27,50.0,1,0,INTACT FINANCIAL-," 7012323  Yeah. Why don't I ask Darren to shed a bit of light on that frequency and severity bumps in the quarter and maybe then rate direction? Darren Godf rey  19791482  Sure. Absolutely. Thanks, Charles. So from a frequency standpoint in the quarter, largely driven by two weather events, a snow event in April in Ontario followed by a similar event, in the May long weekend in Alberta. Both of those drove frequency higher. If we were to exclude those two particular events, frequency was actually relatively flat in the quarter when comparing Q2 of 2016 back to Q2 of 2015. In terms of the severity itself, there's a couple of things that play there. One is actually tied back to the increase in frequency that I just talked about. So due to the increase in frequency in Alberta and Ontario, there was a change in mix, change in the number of claims by province. Obviously, Alberta and Ontario tend to have a higher severity due to the product features in the order of products in those two provinces. So as we got more claims in those two provinces, that drove then the national severity higher as well. We also experienced a bit of a blip in the Atlantic from a severity standpoint. Again, some context here obviously. As you're going to remember, back in Q2 of 2015, we were still experiencing the tough winter in the Atlantic, which drove an exceptional increase in claims being reported, but small event  2134  claims. So that essentially drove the lowest severity back in Q2 of 2015. Now as we look into Q2 of 2016, we're back in more of a normal pattern, consistent with our five-year average, so that's actually driving an increase in severity in the Atlantic. So it really is the Atlantic impact, but also a change in the mix between Alberta, Ontario and the other provinces in the country.",   Yeah Why don't I ask  to shed a bit of light on that frequency and severity bumps in the quer and maybe then rate direction?  Godf rey    Sure Absolutely Thanks  So from a frequency standpoint in the quer largely driven by two weather events a snow event in April in Ontario followed by a similar event in the May long weekend in a Both of those drove frequency higher If we were to exclude those two picular events frequency was actually relatively flat in the quer when comparing Q of  back to Q of  In terms of the severity itself there's a couple of things that play there One is actually tied back to the increase in frequency that I just talked about So due to the increase in frequency in a and Ontario there was a change in mix change in the number of claims by province Obviously a and Ontario tend to have a higher severity due to the product features in the or of products in those two provinces So as we got more claims in those two provinces that drove then the national severity higher as well We also experienced a bit of a blip in the Atlantic from a severity standpoint Again some context here obviously As you're going to remember back in Q of  we were still experiencing the tough winter in the Atlantic which drove an exceptional increase in claims being reported but small event    claims So that essentially drove the lowest severity back in Q of  Now as we look into Q of  we're back in more of a normal pattern consistent with our five-year average so that's actually driving an increase in severity in the Atlantic So it really is the Atlantic impact but also a change in the mix between a Ontario and the other provinces in the country,bit light frequency severity bump quer rate direction thank frequency standpoint quer weather event snow event event weekend frequency event frequency quer q q term severity couple thing increase frequency increase frequency change mix change number claim province severity product product province claim province severity bit blip severity standpoint context q winter increase claim event severity q q pattern year average increase severity impact change mix province country,"['light', 'severity', 'bump', 'direction', 'standpoint', 'weather', 'snow', 'weekend', 'severity', 'province', 'severity', 'province', 'province', 'severity', 'blip', 'severity', 'standpoint', 'context', 'winter', 'severity', 'pattern', 'average', 'severity', 'province']",62,399,19,6.435483870967742,3.263157894736842,24,0.0024986283,0.003534917,0.0072560185,0.004451097,0.0016374404,0.0024772617,0.003706602,0.003734282,0.003870335,0.0052577625,0.0040394207,0.0049748574,0.004434932,0.002674909,0.0054106554,0.0026820651,0.82748365,0.006176283,0.004380396,0.0019431727,0.0041446714,0.040515304,0.00045885675,0.0034680767,0.0028374197,0.0035930027,0.04235794,topic_17
58,Alain Lessard,20140507_INTACT_FINANCIAL-_Earnings_Call_2014-5-7_FS000000002140832731.pdf,2014-05-07,423.0,1,0,INTACT FINANCIAL-," 21962461  Yes. Like we mentioned, the severity was up. Basically we saw more fires during the first quarter and most fire are mostly in apartment buildings and everything where we have a lot more heating that was required during the first quarter due to cold winter situation. We also saw from pipes bursting, mostly sprinkler pipes or anything and these created some water damage that can be also affecting the severity size there because they can be large, when you burst huge sprinkler pipe you affect the larger element of building or the content. So there is, that's what's affected mostly the severity in commercial P&C during the first quarter, all related to what we saw to a longer and colder winter situation.",   Yes Like we mentioned the severity was up Basically we saw more fires during the first quer and most fire are mostly in apment buildings and everything where we have a lot more heating that was required during the first quer due to cold winter situation We also saw from pipes bursting mostly sprinkler pipes or anything and these created some water damage that can be also affecting the severity size there because they can be large when you burst huge sprinkler pipe you affect the larger element of building or the content So there is that's what's affected mostly the severity in  P&C during the first quer all related to what we saw to a longer and col winter situation,severity fire quer fire apment building lot heating quer winter situation pipe sprinkler pipe water damage severity size sprinkler pipe element building content severity quer situation,"['severity', 'apment', 'building', 'heating', 'winter', 'pipe', 'sprinkler', 'pipe', 'water', 'damage', 'severity', 'sprinkler', 'pipe', 'building', 'content', 'severity']",24,151,6,6.291666666666667,4.0,16,0.0035673187,0.00504684,0.010359497,0.006354879,0.0023377915,0.0035368134,0.005291956,0.0053314753,0.0055257194,0.0075065647,0.005767125,0.007102658,0.006331801,0.0038189967,0.0077248514,0.057293076,0.80716044,0.008817947,0.006253939,0.0027742886,0.0059173927,0.0043802783,0.00065511477,0.004951411,0.0040510152,0.005129769,0.007011032,topic_17
3012,Cristina Nestares,20210304_Admiral_Group_PLC-_Earnings_Call_2021-3-4_DN000000002952054801.pdf,2021-03-04,577.0,1,0,Admiral Group," 18674745  Well, just to say Milena, as you mentioned, that we are comfortable to take growth because we understand, we operate in a very cyclical business and if you look at our track record, they have been years where we have grown at a similar level as in 2020 and there have also been years where we have been happy not to grow. So, yes, we operate in that sense. Also the next couple of years could be particularly interesting. We don't know yet, but there might be an opportunity once the FCA reform is implemented and prices in the market go up. So we might need to be ready to take volume very quickly. And also I think the fact that we have done a very strong move to digital and we have very strong systems and team makes it easier for us in the future to take more growth. Moving on to the trends in household in terms of claims, well, in terms of frequency, we saw a reduction in claims frequency in the early lockdown, but after the lockdown it was recovered and it went back to much more normal levels. In terms of severity, what we have seen is basically a change in trends mix. So more accidental damage, although small, reduced theft claims clearly as people have stayed more at home and then severity around escape of water has also been reduced and we think that might continue in the future. So it's clear that as people are allowed to go out more and to travel, we might see claims going back to previous patterns. But we think some of these changes that COVID has brought in terms of spending more time at home will continue in the future. So our expectation for 2021 is similar to 2020, but less strong COVID impact. In terms of weather, 2020 had a bit of a bad weather. Especially at the beginning of the year, we had a few storms cost in Admiral actually 5 million, but this year so far the weather has been quite benign. So that's also important to consider.",   Well just to say  as you mentioned that we are comfortable to take growth because we unstand we operate in a very cyclical  and if you look at our track record they have been years where we have grown at a similar level as in  and there have also been years where we have been happy not to grow So yes we operate in that sense Also the next couple of years could be picularly interesting We don't know yet but there might be an opporty once the FCA reform is implemented and pes in the market go up So we might need to be ready to take volume very quickly And also I think the fact that we have done a very strong move to digital and we have very strong systems and team makes it easier for us in the future to take more growth Moving on to the trends in household in terms of claims well in terms of frequency we saw a reduction in claims frequency in the early lockdown but after the lockdown it was recovered and it went back to much more normal levels In terms of severity what we have seen is basically a change in trends mix So more accital damage although small reduced theft claims clearly as people have stayed more at home and then severity around escape of water has also been reduced and we think that might continue in the future So it's clear that as people are allowed to go out more and to travel we might see claims going back to previous patterns But we think some of these changes that COVID has brought in terms of spending more time at home will continue in the future So our expectation for  is similar to  but less strong COVID impact In terms of weather  had a bit of a bad weather Especially at the beginning of the year we had a few storms cost in Admiral actually  million but this year so far the weather has been quite benign So that's also important to consi,growth track record year level year sense couple year opporty reform pe market volume fact move system team future growth trend household term claim term frequency reduction claim frequency lockdown lockdown level term severity change trend damage theft claim people home escape water future people claim pattern change term time home future expectation impact term weather bit weather beginning year storm year weather,"['track', 'record', 'reform', 'household', 'lockdown', 'lockdown', 'severity', 'damage', 'theft', 'escape', 'water', 'pattern', 'weather', 'weather', 'storm', 'weather']",57,328,16,5.754385964912281,3.5625,16,0.003768814,0.0053319037,0.010944639,0.006713826,0.0024698386,0.0037365856,0.005590865,0.0056326166,0.0058378326,0.007930563,0.0060928734,0.0075038425,0.006689444,0.004034708,0.00816118,0.004045502,0.7962681,0.06579971,0.0066071847,0.002930991,0.006251629,0.0046276925,0.0006921181,0.005231085,0.0042798314,0.0054195174,0.007407041,topic_17
2109,Charles Brindamour,20170802_INTACT_FINANCIAL-_Earnings_Call_2017-8-2_FS000000002394491341.pdf,2017-08-02,92.0,1,0,INTACT FINANCIAL-," 7012323  Darren. Darren Godf rey  19791482  Yeah, I can take that one. So, just a little to unpack the adverse prior development we saw in the quarter, as we have mentioned in past quarters, we tend to get a little bit of noise from quarter-toquarter from pools. Q2 of 2016 and 2017 were two such quarters in particular with prior year developments. So as Louis mentioned, pools contributed 1.6 of the 4.2 points of deterioration in the PYD quarter-over-quarter. So, with respect to the quarter itself, when we look at it before pools, we saw unfavorable PYD of just shy of 2 points, 1. 8 points in particular, and this was largely driven through deterioration in Ontario accident benefit large losses. These were mostly on older accident years, in particular 2013, 2014, stemming from the combining of psychological increase on top of physical injuries. So, this is what we call the stacking effect. It was addressed, as Patrick mentioned, with the change in the definition in June of 2016 in those reforms, but only obviously for new claims beyond June 1, 2016. So, definitely, we saw some pressure there from the nature of those IB  2513  claims, which the reforms are now addressing. In terms of the impact on our plan, our plan is not dependent upon favorable PYD.",     Godf rey    Yeah I can take that one So just a little to unpack the adverse prior development we saw in the quer as we have mentioned in past quers we tend to get a little bit of noise from quer-toquer from pools Q of  and  were two such quers in picular with prior year developments So as  mentioned pools contributed  of the  points of deterioration in the PYD quer-over-quer So with respect to the quer itself when we look at it before pools we saw unfavorable PYD of just shy of  points   points in picular and this was largely driven through deterioration in Ontario accit benefit large losses These were mostly on ol accit years in picular   stemming from the combining of psychological increase on top of physical injuries So this is what we call the stacking effect It was addressed as k mentioned with the change in the definition in e of  in those reforms but only obviously for new claims beyond e   So definitely we saw some pressure there from the nature of those IB    claims which the reforms are now addressing In terms of the impact on our plan our plan is not depent u favorable PYD,rey one development quer quer bit noise toquer pool q quer picular year development pool point deterioration quer quer respect quer pool point point picular deterioration accit loss accit year combining increase top injury stacking effect change definition e reform claim e pressure nature claim reform term impact plan plan PYD,"['rey', 'noise', 'toquer', 'pool', 'pool', 'deterioration', 'pool', 'deterioration', 'accit', 'accit', 'combine', 'injury', 'stacking', 'definition', 'reform', 'nature', 'reform', 'pyd']",45,261,15,5.8,3.0,18,0.0032227207,0.004559322,0.10595743,0.0057410067,0.002111964,0.003195162,0.00478076,0.004816462,0.0049919426,0.0067814407,0.0052100285,0.006416551,0.0057201576,0.0034500868,0.0069786413,0.0034593167,0.7774891,0.007966145,0.005649817,0.0025062962,0.0053457804,0.0039571496,0.0005918316,0.004473111,0.0036596926,0.00463424,0.006333776,topic_17
11345,Richard Whitt,20200429_Markel_Corp-_Earnings_Call_2020-4-29_DN000000002830240082.pdf,2020-04-29,7.0,1,0,Markel Corp-," 7084125  Okay. Mark, I'll attempt that one. Most of our policies exclude business interruption as a result of communicable disease viruses and all of our policies require physical damage. So it's sort of a belt and suspenders approach. First and foremost requires physical damage and then in a lot of cases we have virus exclusions. We have gone through where portfolio of business there, it tends to be small to medium enterprise business in the U.K. and looked at the wording. There are various wordings and again they are different from our U.S. wordings and where we believe there is affirmative coverage, we have made an estimate of the losses that could potentially be there and obviously we are having to make a lot of assumptions in terms of what's the duration of the business shutdown; are they completely shut down? Are they partially shut down? So there is a number of factors that we've put in there, in our typical fashion. As I said in the beginning, we've tried to be more likely redundant than deficient, but there -- as I said, there is a lot of assumptions and a lot of unknowns at this point. In terms of the go-forward, when things getting back to normal, my assumption is going forward, there is probably going to be less grants -coverage related to communicable disease and viruses in the international markets more like the U.S. markets, but that's -- that as we go forward.",   Okay  I'll attempt that one Most of our policies exclude  interruption as a result of communicable disease viruses and all of our policies require physical damage So it's sort of a belt and suspens approach First and foremost requires physical damage and then in a lot of cases we have virus exclusions We have gone through where portfolio of  there it tends to be small to medium enterprise  in the UK and looked at the wording There are various wordings and again they are different from our US wordings and where we beve there is affirmative coverage we have made an estimate of the losses that could potentially be there and obviously we are having to make a lot of assumptions in terms of what's the duration of the  shutdown; are they completely shut down? Are they pially shut down? So there is a number of factors that we've put in there in our typical fashion As I said in the beginning we've tried to be more likely redundant than deficient but there -- as I said there is a lot of assumptions and a lot of unknowns at this point In terms of the go-forward when things getting back to normal my assumption is going forward there is probably going to be less grants -coverage related to communicable disease and viruses in the international markets more like the US markets but that's -- that as we go forward,policy interruption result disease virus policy damage belt suspen approach damage lot case virus exclusion portfolio enterprise wording wording wording coverage estimate loss lot assumption term duration shutdown number factor fashion beginning lot assumption lot unknown point term go forward thing assumption grant disease virus market market,"['interruption', 'disease', 'virus', 'damage', 'belt', 'suspen', 'damage', 'virus', 'exclusion', 'enterprise', 'wording', 'wording', 'wording', 'coverage', 'duration', 'shutdown', 'fashion', 'unknown', 'forward', 'grant', 'disease', 'virus']",45,288,16,6.4,2.8125,22,0.0027009118,0.0038210964,0.048322357,0.004811448,0.001770004,0.0026778153,0.04448559,0.0040366016,0.0041836686,0.0056834193,0.0043664435,0.005377611,0.0047939746,0.002891464,0.0058486904,0.0028991993,0.7730382,0.0066763014,0.0047350232,0.0021004877,0.0044802153,0.043795332,0.00049600477,0.0037488446,0.0030671312,0.0038838843,0.0053082383,topic_17
1888,Brian MacLean,20130423_TRAVELERS_COS_IN-_Earnings_Call_2013-4-23_SD000000002706810436.pdf,2013-04-23,678.0,1,0,TRAVELERS COS," 4679150  Just -- and so just to circle back on the previous question, just a couple quick comments on the big winter storm that we had a couple months ago. We have clearly gotten some claim volume out of that. It hasn't been outsized. It was obviously contemplated in what we booked in the quarter. The -- a couple of comments, from an auto perspective, at least up here in Connecticut, Massachusetts, and the northeast, they really shut down the roads a lot. So there wasn't a lot of activity. And the type of claims that we get, the really damaging winter storm claims we get, tend to be when there is either really extended events, when the snow sits for months on top of roofs and you get damage there, or you get collapses. And fortunately in this event, although we got lots and lots of snow in a short period of time, it warmed up, it got cleared. And so it just wasn't a tremendous event, for at least us. And it doesn't appear to have been in the industry either so.",   Just -- and so just to circle back on the previous question just a couple quick comments on the big winter storm that we had a couple months ago We have clearly gotten some claim volume out of that It hasn't been outsized It was obviously contemplated in what we booked in the quer The -- a couple of comments from an auto perspective at least up here in Connecticut achusetts and the northeast they really shut down the roads a lot So there wasn't a lot of activity And the type of claims that we get the really damaging winter storm claims we get tend to be when there is either really extended events when the snow sits for months on top of roofs and you get damage there or you get collapses And fortunately in this event although we got lots and lots of snow in a short period of time it warmed up it got cleared And so it just wasn't a tremendous event for at least us And it doesn't appear to have been in the industry either so,question couple comment winter storm couple month claim volume quer couple comment auto perspective achusetts northeast road lot lot activity type claim winter storm event snow month top roof damage collapse event lot lot snow period time event industry,"['winter', 'storm', 'auto', 'achusetts', 'northeast', 'road', 'winter', 'storm', 'snow', 'roof', 'damage', 'collapse', 'snow']",38,212,11,5.578947368421052,3.4545454545454546,13,0.0042487886,0.0060109445,0.012338486,0.007568861,0.002784383,0.004212456,0.0063028857,0.0063499543,0.0065813055,0.072617695,0.006868827,0.008459489,0.007541374,0.004548545,0.009200541,0.0045607137,0.770322,0.010502451,0.007448638,0.003304265,0.007047801,0.0052170493,0.0007802623,0.005897286,0.004824886,0.006109716,0.008350359,topic_17
