,participants,file_name,date,idx,company_paticipants_yes,other_paticipants_yes,company_name,paraghrph,paraghrph_clean,paraghrph_noun,token,word_count,char_count,sentence_count,avg_word_length,avg_sentence_length,token_len,topic_1,topic_2,topic_3,topic_4,topic_5,topic_6,topic_7,topic_8,topic_9,topic_10,topic_11,topic_12,topic_13,topic_14,topic_15,topic_16,topic_17,topic_18,topic_19,topic_20,topic_21,topic_22,topic_23,topic_24,topic_25,topic_26,topic_27,main_tp
1305,Ashik Musaddi,20200806_Aviva_PLC-_Earnings_Call_2020-8-6_DN000000002881020327.pdf,2020-08-06,186.0,1,1,Aviva PLC-," 15847584  Just a couple of questions I have is the, first of all, when -- I think you did mention about the Europe and Asia, that it's not bad businesses, it is just that you are looking for opportunities, but I mean, what sort of metric shall we look at to decide whether you're delivering on these businesses or not, whether you want to keep this businesses or not. What sort of metrics would you focus on, would it be cash, operating profit, OCG? What will make you decide that these are the businesses you need to keep and these are the businesses that you don't need to keep? So that could be the first one. Second thing is, can we get some sense on local solvency ratios to understand how the remittances are going to look like for second half of this year and how comfortable you are on the full year remittance for next year? Because clearly, I mean remittances is very important and given that you are planning that you haven't taken out any remittance in first half, it will be good to get some color on how we should think about like second half and next year? And just last one is, sorry, going back to the dividend topic, I mean you mentioned that there will be -- there has been a first interim, second interim and there will be a final dividend. But any color on what should it be based on, should it be based on IFRS earnings, should it be based on Solvency II capital generation, what metrics do we need to focus on or should it be based on remittance basis? So any thoughts on that would be very helpful. Thank you.",   Just a couple of questions I have is the first of all when -- I think you did mention about the  and  that it's not bad es it is just that you are looking for opporties but I mean what sort of met shall we look at to decide whether you're ivering on these es or not whether you want to keep this es or not What sort of mets would you focus on would it be cash operating profit OCG? What will make you decide that these are the es you need to keep and these are the es that you don't need to keep? So that could be the first one Second thing is can we get some sense on local solvency ratios to unstand how the remittances are going to look like for second half of this year and how comfortable you are on the full year remittance for next year? Because clearly I mean remittances is very important and given that you are planning that you haven't taken out any remittance in first half it will be good to get some color on how we should think about like second half and next year? And just last one is sorry going back to the divid topic I mean you mentioned that there will be -- there has been a first interim second interim and there will be a final divid But any color on what should it be based on should it be based on IFRS earnings should it be based on Solvency II capital generation what mets do we need to focus on or should it be based on remittance basis? So any thoughts on that would be very helpful Thank you,couple question opportie sort es es sort met cash operating profit thing sense solvency ratio remittance half year year remittance year remittance remittance half color half year one divid topic interim divid color earning capital generation met remittance basis thought,"['meet', 'operating', 'remittance', 'remittance', 'remittance', 'remittance', 'topic', 'interim', 'meet', 'remittance']",37,221,6,5.972972972972973,6.166666666666667,10,0.005252106,0.0074303807,0.01525212,0.009356187,0.0034418928,0.005207193,0.007791261,0.007849445,0.008135428,0.011051794,0.008490846,0.79759693,0.009322208,0.0056226472,0.011373174,0.0056376895,0.0076595917,0.012982521,0.009207574,0.0040845405,0.008712082,0.006449013,0.0009645149,0.0072898823,0.0059642443,0.007552476,0.010322229,topic_12
5862,James A. Shuck,20181205_ZURICH_INSURANCE-_Shareholder_Mtg_Call_2018-12-5_FS000000002566599289.pdf,2018-12-05,4.0,0,1,ZURICH INSURANCE-," 3680082  Thank you. It's James Shuck from Citi. So two questions from me. George, capital allocation, you've obviously given us a teaser for the year ahead and going into the Investor Day next year. If I think about the ROE of 13% and that target, obviously Farmers is making a very high ROE within that number. Excluding Farmers and also probably LatAm as well, the underlying businesses are probably – there's probably a large chunk of that that's making low-single-digit kind of levels. So just interested know where is the most room to improve the underperforming units, if possible please. And then secondly around that sort of local view versus global units, I'm just interested to know about direct platforms versus kind of a more local view. So if you were to take a centralized view and move to global platforms as opposed to local businesses, what is the best potential on that side, please? Sorry, I'm not feeling too well so, excuse me.",   Thank you It's   from Citi So two questions from me  capital allocation you've obviously given us a teaser for the year ahead and going into the   next year If I think about the ROE of % and that target obviously Farmers is making a very high ROE within that number Excluding Farmers and also probably LatAm as well the unlying es are probably – there's probably a large chunk of that that's making low-single-digit kind of levels So just interested know where is the most room to improve the unperforming s if possible please And then secondly around that sort of local view versus global s I'm just interested to know about direct platforms versus kind of a more local view So if you were to take a centralized view and move to global platforms as opposed to local es what is the best potential on that side please? Sorry I'm not feeling too well so excuse me,question capital allocation teaser year year % target number unlying es chunk digit kind level room unperforming s sort view platform view view platform potential side,"['allocation', 'teaser', 'unlye', 'chunk', 'digit', 'room', 'unperforming', 'potential']",22,132,10,6.0,2.2,8,0.0062334207,0.008818689,0.018101858,0.011104316,0.0040849834,0.0061801164,0.009246997,0.009316052,0.009655468,0.013116735,0.010077293,0.7597795,0.011063989,0.006673195,0.013498163,0.0066910475,0.009090726,0.015408203,0.010927937,0.004847705,0.010339866,0.0076539605,0.0011447269,0.008651939,0.0070786164,0.008963597,0.0122508565,topic_12
7742,Lard Friese,20150211_NN_Group_NV-_Earnings_Call_2015-2-11_DN000000002193547204.pdf,2015-02-11,890.0,1,0,NN Group," 17008174  Thanks everybody. It's the afternoon now. So good afternoon everybody and thank you very much for all of your questions and interest being on this call today, with us. I would like to round off by saying that we are pleased to report a strong set of results for the quarter and for 2014 as a whole. The operating result went up and we're making good progress on reducing expenses in line with our strategic focus. Our capital position, which we discussed I think quite extensively on the call today, we feel is very strong and we are confident that we are well prepared for Solvency 2. The 2014 is the momentous for us on first fronts various fronts, including the IPO and successful debt issues, but also because we are proposing our first dividend, which we hope that our shareholders will approve at the Annual Meeting in May. However, we have a lot of work to do in the coming years. And we will continue to focus on executing our strategy. We are committed to delivering on our targets of generating capital and improving the earnings profile business, well at the same time providing excellence service and products to our customers. Thank you for question, thank you for your attention until the next quarter. Thank you.",   Thanks everybody It's the afternoon now So good afternoon everybody and thank you very much for all of your questions and interest being on this call today with us I would like to round off by saying that we are pleased to report a strong set of results for the quer and for  as a whole The operating result went up and we're making good progress on reducing expenses in  with our strategic focus Our capital position which we discussed I think quite extensively on the call today we feel is very strong and we are confit that we are well prepared for Solvency  The  is the momentous for us on first fronts various fronts including the IPO and successful debt issues but also because we are proposing our first divid which we hope that our sharehols will approve at the ual Meeting in May However we have a lot of work to do in the coming years And we will continue to focus on executing our  We are committed to ivering on our targets of generating capital and improving the earnings profile  well at the same time providing excellence service and products to our customers Thank you for question thank you for your attention until the next quer Thank you,thank afternoon afternoon question interest call today set result quer whole operating result progress expense focus capital position call today confit front front ipo debt issue divid sharehol lot work year target capital earning profile time excellence service product customer question attention quer,"['set', 'operating', 'progress', 'confit', 'ipo', 'profile', 'excellence', 'attention']",36,222,13,6.166666666666667,2.769230769230769,8,0.0062334207,0.008818689,0.018101858,0.011104316,0.0040849834,0.0061801164,0.009246997,0.009316052,0.009655468,0.013116735,0.010077293,0.7597795,0.011063989,0.006673195,0.013498163,0.0066910475,0.009090726,0.015408203,0.010927937,0.004847705,0.010339866,0.0076539605,0.0011447269,0.008651939,0.0070786164,0.008963597,0.0122508565,topic_12
4729,George Quinn,20170810_ZURICH_INSURANCE-_Earnings_Call_2017-8-10_SD000000002905512319.pdf,2017-08-10,419.0,1,0,ZURICH INSURANCE-," 15159240  Yes. It's important to remember that a number of diﬀerent things drive reserve strength. So of course, there are -- there's a reserve strength that you start with and there's the reserve -- the reserve strength that's changed by facts and information that comes to your attention during the course of the quarter. And I think you can see within the PYD that -- I mean, we have some notable one-oﬀs, for example, in New Zealand. And the change that was made there. So at the beginning of the quarter, that would not have formed part of reserve strength. But if we have left it, at the end of the quarter, it would have. So that partly explains why you see the signiﬁcant PYD. But with no impact on reserve strength.",   Yes It's important to remember that a number of diﬀerent things drive reserve strength So of course there are -- there's a reserve strength that you st with and there's the reserve -- the reserve strength that's changed by facts and information that comes to your attention during the course of the quer And I think you can see within the PYD that -- I mean we have some notable one-oﬀs for example in New  And the change that was made there So at the beginning of the quer that would not have formed p of reserve strength But if we have left it at the end of the quer it would have So that ply explains why you see the signiﬁcant PYD But with no impact on reserve strength,number diﬀerent thing reserve strength course reserve strength reserve reserve strength fact information attention course quer oﬀs example change beginning quer p reserve strength end quer ply impact reserve strength,"['strength', 'strength', 'strength', 'attention', 'oﬀs', 'strength', 'ply', 'strength']",23,144,10,6.260869565217392,2.3,8,0.0062334207,0.008818689,0.018101858,0.011104316,0.0040849834,0.0061801164,0.009246997,0.009316052,0.009655468,0.013116735,0.010077293,0.7597795,0.011063989,0.006673195,0.013498163,0.0066910475,0.009090726,0.015408203,0.010927937,0.004847705,0.010339866,0.0076539605,0.0011447269,0.008651939,0.0070786164,0.008963597,0.0122508565,topic_12
1982,Carsten Stolz,20210309_Baloise_Holding_AG-_Earnings_Call_2021-3-9_RT000000002952359872.pdf,2021-03-09,454.0,1,0,Baloise Holding," 6055047  Yes, I'll happily do so. So let's start with the cash remittance, a reference been made to Slide 11. And reference also has been made, what you said, Rene, to the segment and segment profits. The remittance has smaller than the IFRS, has much more to do with local accounts because it's basically cash is remitted from the local and statutory accounts more than from IFRS profits. And there's the prudence principles in statutory accounts and the best estimate principle in IFRS. With regards to restraints that was a part of your question, we have not had restraints in the local statutory accounts with regard to cash remittance in 2020. Now with regards to the composition and trends, what we have put a strong emphasis on since the beginning of Simply Safe Season 1 is that we do have cash remittance from all major business segments, meaning life, non-life and the asset management and banking area which we have achieved. There is a little bit of movement year-on-year. But what's important is that we are on the trajectory to reach the first CHF2 billion. And what's even more important is that we are getting ready to also achieve the next CHF2 billion in one year less, which is a markup of 25%. And I would expect all business segments continue to contribute to volume development, earnings development and from this perspective then translating it also into cash.",   Yes I'll happily do so So let's st with the cash remittance a reference been made to Slide  And reference also has been made what you said  to the segment and segment profits The remittance has smaller than the IFRS has much more to do with local s because it's basically cash is remitted from the local and statutory s more than from IFRS profits And there's the pruce principles in statutory s and the best estimate principle in IFRS h regards to restraints that was a p of your question we have not had restraints in the local statutory s with regard to cash remittance in  Now with regards to the composition and trends what we have put a strong emphasis on since the beginning of Simply Safe Season  is that we do have cash remittance from all major  segments meaning life non-life and the asset  and banking area which we have achieved There is a little bit of movement year-on-year But what's important is that we are on the trajectory to reach the first CHF billion And what's even more important is that we are getting ready to also achieve the next CHF billion in one year less which is a markup of % And I would expect all  segments continue to contribute to volume development earnings development and from this perspective then translating it also into cash,cash remittance reference reference segment segment profit remittance s cash profit pruce principle s estimate principle restraint p question restraint regard cash remittance regard composition trend emphasis beginning cash remittance segment life - life asset banking area bit movement year year trajectory year markup % segment volume development earning development perspective cash,"['remittance', 'reference', 'reference', 'remittance', 'pruce', 'principle', 'principle', 'restraint', 'restraint', 'remittance', 'composition', 'emphasis', 'remittance', 'banking', 'trajectory', 'markup']",46,317,12,6.891304347826087,3.8333333333333335,16,0.0035673187,0.00504684,0.06382336,0.006354879,0.0023377915,0.0035368134,0.005291956,0.0053314753,0.05898958,0.0075065647,0.005767125,0.7555967,0.006331801,0.0038189967,0.0077248514,0.0038292136,0.0052025234,0.008817947,0.006253939,0.0027742886,0.0059173927,0.0043802783,0.00065511477,0.004951411,0.0040510152,0.005129769,0.007011032,topic_12
4715,George Quinn,20170810_ZURICH_INSURANCE-_Earnings_Call_2017-8-10_FS000000002394763370.pdf,2017-08-10,440.0,1,0,ZURICH INSURANCE-," 15159240  Yes. But it's important to remember that a number of different things drive reserve strength. So of course there's the reserve strength that you start with and there's the reserve strength that's changed by facts and information that comes to your attention during the course of the quarter. And I think you can see within the PYD that we have some notable one-offs, for example, in New Zealand and the change that was made there. So at the beginning of the quarter that would not have formed part of reserve strength. But if we had less there at the end of the quarter, it would have. And that partly explains why you see this significant PYD but with no impact on reserve strength.",   Yes But it's important to remember that a number of different things drive reserve strength So of course there's the reserve strength that you st with and there's the reserve strength that's changed by facts and information that comes to your attention during the course of the quer And I think you can see within the PYD that we have some notable one-offs for example in New  and the change that was made there So at the beginning of the quer that would not have formed p of reserve strength But if we had less there at the end of the quer it would have And that ply explains why you see this significant PYD but with no impact on reserve strength,number thing reserve strength course reserve strength reserve strength fact information attention course quer off example change beginning quer p reserve strength end quer ply impact reserve strength,"['strength', 'strength', 'strength', 'attention', 'strength', 'ply', 'strength']",20,126,8,6.3,2.5,7,0.006875762,0.009727436,0.019967217,0.012248592,0.0045059323,0.0068169646,0.010199881,0.010276052,0.010650444,0.014468387,0.011115736,0.7350253,0.012204111,0.0073608537,0.01488912,0.007380546,0.010027506,0.016995985,0.012054037,0.005347251,0.011405367,0.008442685,0.0012626887,0.009543504,0.007808053,0.009887277,0.013513282,topic_12
1443,Bart De Smet,20120514_Ageas_SA-NV-_Earnings_Call_2012-5-14_SD000000002740070599.pdf,2012-05-14,692.0,1,0,Ageas SA-NV-," 16272635  Yes, of course. Ladies and gentlemen, thank you for your good questions. I would say to summarize this call with main conclusions, two of them. First, the results have been good for our First Quarter, typically impacted by some seasonal effects. Inflows levels are excellent, and this is also reflected in our expectation for the year, where we expect inflow globally to out-perform the ones we had in 2011. At the Group level, we cannot ignore the important progress that has been made this quarter in solving partph of our legacies, both the transaction with BNP Paribas on the CASHES and the Tier 1, and the initiatives to further simplify and align our legal structure, are important steps. I think this summarizes the key points I wanted to convey to you this quarter. Thank you, once again, for your continued interest and support. Do not hesitate to contact our investor relations teams, should you have outstanding questions. Thank you for your time, and I would like to wish you a very nice day. Goodbye.",   Yes of course Ladies and gentlemen thank you for your good questions I would say to summarize this call with main conclusions two of them First the results have been good for our First Quer typically impacted by some seasonal effects Inflows levels are excellent and this is also reflected in our expectation for the year where we expect inflow globally to out-perform the ones we had in  At the  level we cannot ignore the important progress that has been made this quer in solving pph of our legacies both the transaction with BNP Paribas on the CASHES and the Tier  and the initiatives to further simplify and align our legal structure are important steps I think this summarizes the key points I wanted to convey to you this quer Thank you once again for your continued interest and support Do not hesitate to contact our investor relations teams should you have outstanding questions Thank you for your time and I would like to wish you a very nice day Goodbye,course lady gentleman question call conclusion result effect inflow level expectation year inflow one level progress quer legacy transaction initiative structure step point interest support investor relation team question time day goodbye,"['conclusion', 'inflow', 'inflow', 'progress', 'legacy', 'initiative', 'step', 'support', 'relation', 'goodbye']",27,180,12,6.666666666666667,2.25,10,0.005252106,0.0074303807,0.01525212,0.009356187,0.0034418928,0.005207193,0.007791261,0.007849445,0.008135428,0.011051794,0.008490846,0.7188829,0.009322208,0.0056226472,0.011373174,0.0056376895,0.0076595917,0.0916965,0.009207574,0.0040845405,0.008712082,0.006449013,0.0009645149,0.0072898823,0.0059642443,0.007552476,0.010322229,topic_12
446,Alex Wynaendts,20161208_Aegon_NV-_Shareholder_Mtg_Call_2016-12-8_SD000000002901637571.pdf,2016-12-08,338.0,1,0,Aegon NV-," 1821092  We did mention that flexibility, as you can see, it's always good to have some of the flexibility in your plan because we are also expecting interest rates at quite a different level, particular also in the Netherlands. So we've been looking at ways of ensuring that we continue to be able to support THE dividend payment. We also showed you in January at that point in time that there was an amount of capital that would be made available to our business in Asia to grow. That has been adjusted downwards. So we're trying to move the different parts in order to maintain flexibility around the total number while ensuring that we are able to pay the dividends and the total return to shareholders of EUR2.1 million. So I'm not going to go now at this point in time and provide you an adjusted new number around flexibility. But that flexibility allows us to see differences between the moving parts, all with the objective of being able to secure our commitment on return to shareholders.",   We did mention that flexibility as you can see it's always good to have some of the flexibility in your plan because we are also expecting interest rates at quite a different level picular also in the Netherlands So we've been looking at ways of ensuring that we continue to be able to support THE divid payment We also showed you in uary at that point in time that there was an amount of capital that would be made available to our  in  to grow That has been adjusted downwards So we're trying to move the different ps in or to maintain flexibility around the total number while ensuring that we are able to pay the divids and the total return to sharehols of EUR million So I'm not going to go now at this point in time and provide you an adjusted new number around flexibility But that flexibility allows us to see differences between the moving ps all with the objective of being able to secure our commitment on return to sharehols,flexibility flexibility plan interest rate level picular way divid payment uary point time amount capital ps flexibility number divid return sharehol point time number flexibility flexibility difference moving ps objective commitment return sharehol,"['flexibility', 'flexibility', 'payment', 'uary', 'flexibility', 'flexibility', 'flexibility', 'move', 'objective', 'commitment']",28,194,9,6.928571428571429,3.111111111111111,10,0.005252106,0.0074303807,0.093966104,0.009356187,0.0034418928,0.005207193,0.007791261,0.007849445,0.008135428,0.011051794,0.008490846,0.7188829,0.009322208,0.0056226472,0.011373174,0.0056376895,0.0076595917,0.012982521,0.009207574,0.0040845405,0.008712082,0.006449013,0.0009645149,0.0072898823,0.0059642443,0.007552476,0.010322229,topic_12
